{
  "schema_version": 1,
  "id": "final-cut-pro",
  "display_name": "Final Cut Pro",
  "category": "video-editor",
  "platforms": ["macos"],
  "detection": {
    "macos": { "bundle_id": "com.apple.FinalCut" }
  },
  "search_first_supported": false,
  "vendor_friendly": "friendly",
  "locale": "en",
  "agent_primer": "Final Cut Pro is Apple's professional non-linear video editor. macOS-only. There is no command palette equivalent — canonical action surfaces are the top menu bar, single-letter keyboard shortcuts (FCP is famously shortcut-heavy), and direct manipulation in the Timeline. The accessibility tree is reasonable for menus / dialogs but the Viewer and Timeline are largely opaque to AX (custom canvases). Verification should default to `interpret_check` (vision) for timeline / viewer state, and to `file_check` for export results.\n\nKey UI elements (default workspace, FCP 10.7+):\n\n- **Browser** (top-left): the media organizer. Holds Libraries (top-level containers, on disk as `.fcpbundle` packages), Events (groupings inside a Library), and Projects (editable timeline sequences). Imported clips live here as references — FCP doesn't move source media unless asked.\n- **Viewer** (top-right): the playback monitor. Shows whatever is under the playhead OR (when skimming is on) whatever the mouse is hovering over.\n- **Timeline** (bottom, full-width): the edit surface. FCP's distinguishing concept is the **magnetic timeline**: clips on the Primary Storyline snap together — no gaps unless you make them. Clips above / below attach as **Connected Clips**. Trim a clip and downstream clips ripple shut automatically.\n\nKey concepts:\n\n- **Skimming vs playback**: when clip skimming is on (`s` toggle), hovering the mouse over a clip previews video at that frame in the Viewer in real time. The **playhead** (vertical white line in the Timeline) is separate and is what spacebar controls. Skimming and playhead positions can disagree.\n- **Selection vs range**: clicking a clip selects the whole clip; the Range Selection tool (`r`) selects a partial time range. Ranges drive trim / blade / replace operations.\n- **In and Out points** (`i` / `o`): mark the active range on a Browser clip or in the Timeline. Used by Insert / Append / Overwrite edits and by Share to define the export span.\n- **Markers** (`m`): a label pinned to a frame on a clip. Press `m` once to drop, twice to label.\n- **Blade**: `b` enters the Blade TOOL (sticky); `cmd+b` slices at the playhead WITHOUT changing the active tool. Prefer `cmd+b` for one-shot cuts.\n- **Snapping** (`n` toggle): when on, the playhead and edit points snap to clip boundaries, markers, and other anchors.\n- **Keywords vs Roles**: keywords are tags on Browser clips for search and smart collections. Roles (Dialogue, Music, Effects, Titles by default) are editorial categories assigned to audio components and used for routing in mixdowns / exports. Roles are NOT keywords.\n\nTypical export path: `File → Share → Master File…` opens the Share sheet for the selected Project or active timeline. Common destinations include Master File (full-quality ProRes / H.264), Apple Devices, YouTube & Facebook. Share sheets are modal — they commit on the dialog's Next / Save button, not on Enter.\n\nMost FCP shortcuts are single letters (no cmd modifier) — that's intentional. Make sure the Timeline (or the pane the shortcut targets) has focus before sending keys; many FCP single-letter keys are mode toggles or tool selections, so ordering matters.\n\nVersion notes: this seed targets FCP 10.7+. Earlier 10.6.x is mostly compatible but a few menu paths shifted (Share sheet redesign, Object Tracker availability)."
}
