{
  "schema_version": 1,
  "id": "rhino",
  "display_name": "Rhino",
  "category": "3d-modeler",
  "platforms": ["macos"],
  "detection": {
    "macos": { "bundle_id": "com.mcneel.rhinoceros" }
  },
  "search_first_supported": true,
  "command_palette_shortcut": {
    "macos": "cmd+option+c"
  },
  "vendor_friendly": "friendly",
  "locale": "en",
  "agent_primer": "Rhino (Rhinoceros) is McNeel's NURBS-based 3D modeling application — popular with architects, industrial designers, and jewelry / product designers who need precise free-form surfaces. v0 of this seed targets Rhino 8+ on macOS; the bundle id is `com.mcneel.rhinoceros`. The accessibility tree exposes the menu bar, Properties / Layers / Display panels, and most modal dialogs, but the modeling viewports themselves are an OpenGL canvas — fully opaque to AX. Default verification is `interpret_check` (vision) for anything that affects geometry; `file_check` is appropriate for export results.\n\nKey UI elements (default workspace):\n\n- **Command line** (top, above the viewports): Rhino's primary action surface. ALWAYS VISIBLE. Type a command name (`LINE`, `CIRCLE`, `BOX`, `EXTRUDE`, `LOFT`, `SUBD`) followed by Enter to invoke it. Most commands accept aliases (`L` = `LINE`, `C` = `CIRCLE`, `M` = `MOVE`). The command line is treated as Rhino's command palette — when authoring shortcuts that drive a Rhino command, prefer `method: \"search\"` and the command-line typing pattern over keyboard shortcuts. This is more version-stable than keybinds and matches how Rhino users actually work. To focus the command line: clicking on the canvas already routes typed characters to it, but a few app-wide cmd-modified shortcuts are reserved (`cmd+s`, `cmd+z`, etc.) and use real `key_combo` actions.\n- **Command history** (just below the command line): scrolling log of recent commands and their prompts. Useful for debugging when a shortcut appears to do nothing — the prompt may be waiting for an argument the script didn't supply.\n- **Viewports** (the modeling canvases): Rhino opens with four viewports by default — `Top`, `Front`, `Right`, `Perspective`. Toggle to a single maximized viewport with `MAXVIEWPORT` (typed) or `ctrl+M` in some configs; the four-up layout is restored with `4VIEW`. Each viewport has its own camera and shading mode. **Right-mouse-button drag** rotates the camera in Perspective; in orthographic viewports it pans. Mouse-wheel zooms.\n- **Tabbed panels** (right side): Properties (selection inspector), Layers (organizer), Display (per-viewport mode), Lights, Materials, Render. Tabs may be torn out into floating windows; the v0 seed assumes default docking.\n- **OSNAP toolbar** (bottom): object snap toggles. End, Near, Point, Mid, Cen, Int, Perp, Tan, Quad, Knot, Vertex, Project, Disable. Object snaps are persistent state — toggling Mid on once leaves it on across commands until toggled off.\n- **Status bar** (very bottom): coordinate readout, units, OSNAP indicator, Gumball toggle, SmartTrack toggle, Ortho / Planar mode toggles, Layer / Color picker.\n\nKey concepts:\n\n- **NURBS vs SubD**: Rhino's classic surface type is NURBS (analytic, exact, parametric). Rhino 7+ added SubD (subdivision surfaces, like polygons but smooth). Many commands have NURBS and SubD variants (`LOFT` works on both; `TOSUBD` and `FROMSUBD` convert between them). Unless a command name explicitly says SUBD, assume NURBS.\n- **Layers**: every object lives on exactly one layer. Layers carry name, color, linetype, print width, lock state, and visibility. Drives selection (`SELBYLAYER`), display, and print output.\n- **Gumball**: a translate / rotate / scale widget that appears on selected objects. Toggle with the Gumball button in the status bar (or `F9` in many configs). When on, dragging gumball arrows moves geometry; clicking-then-typing a number performs an exact transform.\n- **Object snap (OSNAP)**: as the cursor approaches a snap-eligible point (endpoint, midpoint, center) Rhino glues the cursor to it. Persistent across commands — toggled in the OSNAP toolbar.\n- **SmartTrack**: temporary inferred guide lines that appear after hovering over snap points. Off by default; enable in the status bar.\n- **Named views / named CPlanes / Snapshots**: bookmarks for the camera, the construction plane, and the entire model state respectively. Useful for restoring a known good viewing or working configuration.\n- **History**: optional record of construction relationships. When on, editing a parent curve updates a child surface (`Loft` etc.) — a lightweight parametric chain. Off by default; toggle with `RECORDHISTORY`.\n\nFile types: `.3dm` is Rhino's native format (preserves NURBS, SubD, layer / material / render data). Native importers / exporters include `STL`, `OBJ`, `IGES`, `STEP`, `DWG`, `DXF`, `FBX`, `3DS`, `PLY`, `SKP`. Use `EXPORT` for selection-only exports and `EXPORTSTL` / `EXPORTOBJ` / `EXPORTSTEP` etc. for format-specific shortcuts. The macOS Save dialog accepts `cmd+shift+g` to type a path directly — the same pattern used in the open-file shortcut.\n\nDestructive operations: `BooleanDifference`, `BooleanUnion`, `BooleanIntersection`, `Trim`, `Split`, `Explode`, `Purge`, layer-delete. Most are undoable but boolean and trim operations on complex bodies can be slow to recover. Save before bulk operations.\n\nVersion notes: this seed targets Rhino 8+. Rhino 7 is mostly command-compatible (SubD shipped in 7), but the macOS UI / panel layout differs slightly. Earlier versions (5 / 6) lack SubD entirely — those commands will fail."
}
