{
  "schema_version": 1,
  "id": "davinci-resolve",
  "display_name": "DaVinci Resolve",
  "category": "video-editor",
  "platforms": ["macos"],
  "detection": {
    "macos": { "bundle_id": "com.blackmagic-design.DaVinciResolve" }
  },
  "search_first_supported": false,
  "vendor_friendly": "friendly",
  "locale": "en",
  "agent_primer": "DaVinci Resolve is Blackmagic Design's pro post-production suite — edit, color grade, Fusion VFX, and Fairlight audio in a single binary. The defining mental model is **pages**: the entire UI swaps layout when you change page, so the same keystroke can mean different things depending on which page is frontmost. v0 targets Resolve 19+ on macOS.\n\n**Pages** (canonical order, switched via `shift+1` … `shift+7` or by clicking the page tabs at the bottom of the window):\n\n- **Media** (`shift+1`) — ingest, organize source clips, sync audio, manage proxies. Bin browser on the left, viewer center, Metadata / Audio panel right.\n- **Cut** (`shift+2`) — fast turn-around editing with a single source-and-timeline viewer and a sync bin. Keyboard-heavy.\n- **Edit** (`shift+3`) — the classic two-up source/timeline editor. Inspector top-right, Effects / Sound / Edit Index panels above the viewers, Mixer + Metadata panels above the timeline. Most editing shortcuts (J/K/L, I/O, F9/F10/F11/F12) live here.\n- **Fusion** (`shift+4`) — node-graph compositor for VFX, motion graphics, and titles. Two viewers (foreground / background), node graph below, Inspector right. Fusion is its own model: nodes are added by dragging from the toolbar or via 1-key shortcuts (B background, M merge, T transform, B blur).\n- **Color** (`shift+5`) — Resolve's flagship surface. **Node graph** top-right (each node is a grade layer), **viewer** top-left, **scopes / gallery** below the viewer, **primary controls** (lift / gamma / gain wheels, log wheels, offset, color bars / curves) bottom. Modes: serial nodes (`option+S`) chain corrections; parallel nodes (`option+P`) blend; layer nodes (`option+L`) stack. Toggling a node's effect: `D` disables / enables. The Qualifier (HSL keying), Power Window, and Tracker are sub-tools on the bottom-center selector.\n- **Fairlight** (`shift+6`) — multi-track audio post: mixer, EQ, dynamics, panner, automation. Track header left, mixer / channel strips center, meters right. Automation modes: Read / Touch / Latch / Write.\n- **Deliver** (`shift+7`) — render queue. Left panel chooses preset (YouTube, ProRes, H.264 Master), center is render settings + render-queue list, right is the timeline / source viewer.\n\n**Project / database model**: Resolve uses a project library (PostgreSQL or disk-backed) holding many projects. The Project Manager (`shift+1` does NOT open it; use `cmd+shift+1` or File → Project Manager) is a separate window. Projects auto-save by default (every 5 min); manual save is `cmd+s`.\n\n**Bins, clips, and the timeline**: Bins live in the Media Pool (`shift+4` toggles its visibility on Edit page). Drag a clip to the source viewer or the timeline. The active timeline is the one shown in the timeline viewer; new timelines come from `cmd+n` (project) or `cmd+option+n` (timeline) — note Resolve uses `option`, not `alt` (macOS).\n\n**Edit-page playback** is J/K/L (rewind / pause / play, multi-tap for speed), space toggles play, comma / period nudge by frame, `,` / `.` with `shift` step by clip. **Trim mode**: `T` cycles tools; **blade**: `B`; **selection**: `A`; **range select**: `R`. **In/Out points**: `I` / `O`. **Mark clip**: `X`. **Mark selection**: `shift+A` (alias of selection range). **Add edit at playhead**: `cmd+\\`.\n\n**Edit-page edit functions** (the four big ones — F-keys): **insert** `F9` (push downstream clips right), **overwrite** `F10` (replace timeline content under source range), **replace** `F11` (replace clip at playhead), **fit-to-fill** `shift+F11`, **place on top** `F12` (drop on next available track), **append** (no default — `shift+F12`).\n\n**Color-page node operations**: `option+S` add serial node, `option+P` add parallel node, `option+L` add layer node, `option+O` add outside node, `option+S` again to chain. `D` toggles node bypass. `cmd+H` hides the entire grade for the current clip (before / after compare). The Gallery (left of viewer) holds saved stills — `cmd+option+G` grabs a still, dragging from Gallery onto a clip applies its grade.\n\n**Common output flow**: Deliver page → choose preset → set output range → Add to Render Queue → Render All. Final rendered files land in the directory configured in the preset.\n\n**Surfaces stable enough to script against**: top menu bar (`DaVinci Resolve`, `File`, `Edit`, `Trim`, `Timeline`, `Clip`, `Mark`, `View`, `Playback`, `Fusion`, `Color`, `Fairlight`, `Workspace`, `Help`) and the page-switch shortcuts. Keyboard shortcuts on the **non-active page** are dropped silently — always switch page first when in doubt.\n\n**Verification**: the canvas (viewer) and node graph are not introspectable via the macOS AX tree in any useful way for v0. Default to `interpret_check` for anything that affects pixels, audio output, or node graph state. Use `file_check` for delivered renders. Save / Save As also benefit from `interpret_check` because Resolve auto-saves and the save indicator is subtle.\n\n**Modal dialogs to expect** (the workflow's `pre_step` dismisses transient ones with escape): startup splash / project-manager prompt, \"unsaved changes\" warning when switching projects, \"render in progress\" warnings on quit, GPU-detection notices on first launch after an update, Color Management migration prompts. Save / Save As / Export user-initiated dialogs should NOT be escaped — the shortcut authoring those flows is responsible for navigating them."
}
