{
  "schema_version": 1,
  "id": "photoshop",
  "display_name": "Adobe Photoshop",
  "category": "image-editor",
  "platforms": ["macos"],
  "detection": {
    "macos": { "bundle_id": "com.adobe.Photoshop" }
  },
  "search_first_supported": false,
  "vendor_friendly": "friendly",
  "locale": "en",
  "agent_primer": "Adobe Photoshop is a layered raster image editor. It has no command palette equivalent; canonical action surfaces are the top menu bar, keyboard shortcuts, the Tools panel (with modal tool selection), and the contextual Options bar. Most non-trivial operations open a modal dialog you must commit (Enter / OK) or cancel (Escape). The canvas is largely opaque to the macOS accessibility tree — verification on Photoshop should default to `interpret_check` (vision) for anything that affects pixels, and to `file_check` for anything that writes to disk. v0 is macOS-only because the underlying `os.action` / `wait_for_idle` paths are macOS-only.\n\nKey UI elements (default workspace, latest Photoshop):\n\n- **Canvas** (center): the primary edit surface. Zoom level varies (`cmd+0` fits screen, `cmd+1` 100%). Most operations target the canvas of the **active document**. Multiple open documents appear as tabs across the top of the canvas area; switch with `ctrl+tab` (yes — `ctrl`, not `cmd` — because `cmd+tab` is macOS app-switching).\n- **Layers panel** (right by default): the unit of composition. The **active layer** receives most layer-modifying operations (brightness adjustments applied destructively, paint strokes, fills). A layer can be hidden (eye icon), locked (padlock), or grouped. New documents start with a single locked Background layer; many operations prompt to convert it before proceeding.\n- **Tools panel** (left edge, vertical strip): modal tool selector. The active tool determines what most keystrokes and click-drag gestures do. Single-letter shortcuts switch tools (V Move, M Marquee, L Lasso, W Quick Selection, C Crop, B Brush, E Eraser, T Type, etc.). Tool selection IS state — a script that assumes the Crop tool is active must press `C` first.\n- **Top menu bar**: `File`, `Edit`, `Image`, `Layer`, `Type`, `Select`, `Filter`, `3D`, `View`, `Window`, `Help`. Menu paths are the most version-stable action surface; prefer them over raw keybinds when a keybind hasn't been verified on the user's specific Photoshop version.\n- **Options bar** (top, just under the menu bar): contextual to the active tool. The Crop tool's options bar exposes width / height / resolution fields; the Brush tool's exposes size / hardness / opacity. Field focus matters — `tab` cycles fields when the options bar has focus.\n- **Document tabs** (across top of canvas area): one Photoshop window can host many open files.\n\nUndo / history:\n\n- `cmd+Z` is single-step undo (Photoshop 22+ defaults to this; older versions toggled the previous action).\n- `cmd+shift+Z` redoes / steps forward.\n- `cmd+alt+Z` steps backward through the History panel (multi-step undo).\n- The **History panel** (Window → History) shows the full step list and lets you click any state to revert.\n\nSave behavior — important and modal-heavy:\n\n- `cmd+S` saves to the document's current path. On a new untitled document, this opens the **Save As** dialog instead.\n- `cmd+shift+S` is **Save As** — opens a file-format chooser.\n- **File → Save a Copy…** (`cmd+alt+S` on recent versions) writes a copy in a chosen format without flipping the in-memory document to that format. Good default for non-PSD writes.\n- **File → Export → Export As…** (`cmd+alt+shift+W`) opens a richer export dialog with per-format quality controls. This is the most reliable path for JPG/PNG writes — it sidesteps the \"flatten layers?\" prompts that PSD-aware paths trigger.\n- Native `.psd` saves preserve layers and adjustment metadata; flat formats (JPG, PNG) flatten and may prompt to discard layer information.\n\nCommon modal dialogs to expect (the workflow's `pre_step` dismisses the most common transient ones with `escape`; user-initiated dialogs like Save As, Brightness/Contrast, format-confirm should NOT be escaped — they are part of intended flows):\n\n- **License Reminder / Subscription Notice** — transient overlay on launch when the Creative Cloud subscription is near expiry. Safe to escape.\n- **Photoshop Update Available** — transient. Safe to escape.\n- **Welcome Screen / Tutorial overlay** — appears on first launch or after updates. Safe to escape.\n- **Color Profile Mismatch** (\"The document's embedded color profile does not match the working space\") — appears on file open. Safe to dismiss with the default; user-facing decision rarely matters for v0 shortcuts.\n- **Save As file dialog** — user-initiated; do NOT escape. The shortcut authoring this dialog is responsible for navigating it (filename field, format dropdown, Save button).\n- **Brightness/Contrast, Hue/Saturation, Levels, Curves** — modeless? No — these are modal dialogs blocking until OK or Cancel. Adjustments commit on Enter / OK.\n- **\"Discard color information?\"** — appears on `Image → Mode → Grayscale` when the document has color data. Confirm to proceed with grayscale conversion.\n- **\"Apply mask before flattening?\"**, **\"Flatten image?\"** — appear on save-as-flat-format paths.\n\nAccessibility-tree caveats:\n\n- The canvas itself is essentially invisible to the macOS AX tree — it's drawn into a custom view. **Use vision (`interpret_check`) for any verification of canvas pixel state.**\n- Modal dialog presence and button labels DO show up in the AX tree, but the v0 MCP doesn't expose them — interpret_check for modal verification too in v0.\n- File-system writes verify cleanly via `file_check`.\n\nVersion notes: this seed targets Photoshop 25+ (Creative Cloud 2024 / 2025 line). Earlier versions (24 and below) may differ on: the default Save As keybind, the Export As keyboard shortcut, and the Crop tool's options-bar layout. If you're on an older version, prefer menu navigation over keybinds for save/export paths."
}
